trait	study	hit_combat	hit_onek1k	hit_both	hit_neither	snp_count	hit_check
AIDS progression	Genomewide association study of an AIDS-nonprogression cohort emphasizes the role played by HLA genes (ANRS Genomewide Association Study 02).	0	0	0	1	1	TRUE
Acute anterior uveitis (with or without ankylosing spondylitis)	Genetic dissection of acute anterior uveitis reveals similarities and differences in associations observed with ankylosing spondylitis.	0	1	0	6	7	TRUE
Adult asthma	Association study in African-admixed populations across the Americas recapitulates asthma risk loci in non-African populations.	0	0	1	2	3	TRUE
Allergic disease (asthma, hay fever and/or eczema) (multivariate analysis)	Age-of-onset information helps identify 76 genetic variants associated with allergic disease.	0	9	2	41	52	TRUE
Allergic disease (asthma, hay fever or eczema)	Genome-wide association analysis of 350 000 Caucasians from the UK Biobank identifies novel loci for asthma, hay fever and eczema.	1	13	1	64	79	TRUE
Allergic rhinitis	Genome-wide association and HLA fine-mapping studies identify risk loci and genetic pathways underlying allergic rhinitis.	1	7	2	31	41	TRUE
Allergy	Detection and interpretation of shared genetic influences on 42 human traits.	0	4	2	19	25	TRUE
Alzheimer disease (MTAG)	A Multi-Trait Association Analysis of Brain Disorders and Platelet Traits Identifies Novel Susceptibility Loci for Major Depression, Alzheimer's and Parkinson's Disease.	0	1	0	1	2	TRUE
Alzheimer's disease	Common variants in Alzheimer's disease and risk stratification by polygenic risk scores.	0	2	0	7	9	TRUE
Alzheimer's disease (late onset)	Genetic meta-analysis of diagnosed Alzheimer's disease identifies new risk loci and implicates Aβ, tau, immunity and lipid processing.	0	0	1	6	7	TRUE
Alzheimer's disease in APOE e4+ carriers	A novel Alzheimer disease locus located near the gene encoding tau protein.	0	0	0	4	4	TRUE
Alzheimer's disease in APOE e4- carriers	A novel Alzheimer disease locus located near the gene encoding tau protein.	0	0	0	3	3	TRUE
Alzheimer's disease or family history of Alzheimer's disease	GWAS on family history of Alzheimer's disease.	1	3	0	65	69	TRUE
Alzheimer's disease with visuospatial domain impairment	Genetic data and cognitively defined late-onset Alzheimer's disease subgroups.	0	0	0	0	0	TRUE
Amyotrophic lateral sclerosis	Genome-wide association analyses identify new risk variants and the genetic architecture of amyotrophic lateral sclerosis.	1	0	0	5	6	TRUE
Amyotrophic lateral sclerosis (sporadic)	Genome-wide association study combining pathway analysis for typical sporadic amyotrophic lateral sclerosis in Chinese Han populations.	0	0	0	17	17	TRUE
Ankylosing spondylitis	Interaction between ERAP1 and HLA-B27 in ankylosing spondylitis implicates peptide handling in the mechanism for HLA-B27 in disease susceptibility.	0	0	1	8	9	TRUE
Antineutrophil cytoplasmic antibody-associated vasculitis	Genetically distinct subsets within ANCA-associated vasculitis.	0	1	0	8	9	TRUE
Arthritis (juvenile idiopathic)	Combined genetic analysis of juvenile idiopathic arthritis clinical subtypes identifies novel risk loci, target genes and key regulatory mechanisms.	0	1	0	12	13	TRUE
Asthma	Eighty-eight variants highlight the role of T cell regulation and airway remodeling in asthma pathogenesis.	0	12	2	71	85	TRUE
Asthma (adult onset)	Shared Genetic and Experimental Links between Obesity-Related Traits and Asthma Subtypes in UK Biobank.	0	10	2	63	75	TRUE
Asthma (childhood onset)	Genetic Architectures of Childhood- and Adult-Onset Asthma Are Partly Distinct.	1	11	2	84	98	TRUE
Asthma (moderate or severe)	A whole genome sequencing study of moderate to severe asthma identifies a lung function locus associated with asthma risk.	0	1	1	6	8	TRUE
Asthma and hay fever	Genome-wide association analysis identifies 11 risk variants associated with the asthma with hay fever phenotype.	0	1	1	8	10	TRUE
Asthma in any disease	Discerning asthma endotypes through comorbidity mapping.	0	9	3	91	103	TRUE
Asthma or allergic disease (pleiotropy)	A genome-wide cross-trait analysis from UK Biobank highlights the shared genetic architecture of asthma and allergic diseases.	0	5	3	30	38	TRUE
Asthma with severe exacerbations	Genome-wide association study reveals a novel locus for asthma with severe exacerbations in diverse populations.	0	0	3	1	4	TRUE
Asthma-COPD overlap syndrome	Genetic associations and architecture of asthma-chronic obstructive pulmonary disease overlap.	0	1	1	11	13	TRUE
Atopic asthma	Shared Genetic and Experimental Links between Obesity-Related Traits and Asthma Subtypes in UK Biobank.	1	23	3	168	195	TRUE
Atopic dermatitis	European and multi-ancestry genome-wide association meta-analysis of atopic dermatitis highlights importance of systemic immune regulation.	1	7	1	76	85	TRUE
Atopic march	Meta-analysis identifies seven susceptibility loci involved in the atopic march.	0	1	0	4	5	TRUE
Autoimmune hepatitis type-1	Genome-wide association study identifies variants associated with autoimmune hepatitis type 1.	0	1	0	0	1	TRUE
Autoimmune neurological syndromes with anti-GAD65 autoantibodies	A genome-wide association study in autoimmune neurological syndromes with anti-GAD65 autoantibodies.	1	1	0	33	35	TRUE
Autoimmune thyroid disease	FLT3 stop mutation increases FLT3 ligand level and risk of autoimmune thyroid disease.	0	16	2	81	99	TRUE
Autoimmune thyroid diseases (Graves disease or Hashimoto's thyroiditis)	Seven newly identified loci for autoimmune thyroid disease.	0	1	0	2	3	TRUE
Autoimmune traits	Leveraging Polygenic Functional Enrichment to Improve GWAS Power.	1	9	3	59	72	TRUE
Behcet's disease	Genetic association of a gain of function interferon gamma receptor 1 (IFNGR1) polymorphism and the intergenic region LNCAROD/DKK1 with Behçet's disease.	0	0	0	8	8	TRUE
Birdshot chorioretinopathy	A genome-wide association study identifies a functional ERAP2 haplotype associated with birdshot chorioretinopathy.	0	0	1	1	2	TRUE
COVID-19	A year of COVID-19 GWAS results from the GRASP portal reveals potential genetic risk factors.	0	0	0	0	0	TRUE
COVID-19 (critical illness vs population or mild symptoms)	Whole genome sequencing reveals host factors underlying critical Covid-19.	2	2	2	42	48	TRUE
COVID-19 (critical illness vs population)	Genetic mechanisms of critical illness in Covid-19.	0	2	0	5	7	TRUE
COVID-19 (hospitalized covid vs population)	GWAS and meta-analysis identifies 49 genetic variants underlying critical COVID-19.	1	6	1	39	47	TRUE
COVID-19 (hospitalized vs not hospitalized)	A year of COVID-19 GWAS results from the GRASP portal reveals potential genetic risk factors.	0	0	0	0	0	TRUE
COVID-19 (hospitalized vs population)	Mapping the human genetic architecture of COVID-19.	0	1	1	7	9	TRUE
COVID-19 (hospitalized vs tested, not hospitalized)	A year of COVID-19 GWAS results from the GRASP portal reveals potential genetic risk factors.	0	0	0	0	0	TRUE
COVID-19 (severe vs non-severe with positive test)	A year of COVID-19 GWAS results from the GRASP portal reveals potential genetic risk factors.	0	0	0	0	0	TRUE
COVID-19 (severe vs population)	A year of COVID-19 GWAS results from the GRASP portal reveals potential genetic risk factors.	0	0	0	0	0	TRUE
COVID-19 (severe vs tested, not severe)	A year of COVID-19 GWAS results from the GRASP portal reveals potential genetic risk factors.	0	0	0	0	0	TRUE
COVID-19 severity	Genetic risk factors and COVID-19 severity in Brazil: results from BRACOVID study.	1	3	7	26	37	TRUE
COVID-19 with respiratory failure	Detailed stratified GWAS analysis for severe COVID-19 in four European populations.	1	1	1	10	13	TRUE
COVID-19 with respiratory failure requiring mechanical ventilation	Detailed stratified GWAS analysis for severe COVID-19 in four European populations.	0	3	0	9	12	TRUE
Celiac disease	Newly identified genetic risk variants for celiac disease related to the immune response.	0	0	2	3	5	TRUE
Chickenpox	Genome-wide association and HLA region fine-mapping studies identify susceptibility loci for multiple common infections.	0	1	0	3	4	TRUE
Childhood asthma	Role of Sex on the Genetic Susceptibility to Childhood Asthma in Latinos and African Americans.	0	0	1	0	1	TRUE
Childhood asthma with severe exacerbations	FUT2-ABO epistasis increases the risk of early childhood asthma and Streptococcus pneumoniae respiratory illnesses.	0	2	3	13	18	TRUE
Childhood onset ulcerative colitis	Enhanced Contribution of HLA in Pediatric Onset Ulcerative Colitis.	0	0	0	1	1	TRUE
Chronic glomerulonephritis	A cross-population atlas of genetic associations for 220 human phenotypes.	0	1	0	1	2	TRUE
Chronic hepatitis B infection	Genetic variants in five novel loci including CFB and CD40 predispose to chronic hepatitis B.	0	6	1	2	9	TRUE
Chronic hepatitis C infection	A cross-population atlas of genetic associations for 220 human phenotypes.	0	3	0	3	6	TRUE
Chronic inflammatory diseases (ankylosing spondylitis, Crohn's disease, psoriasis, primary sclerosing cholangitis, ulcerative colitis) (pleiotropy)	Analysis of five chronic inflammatory diseases identifies 27 new associations and highlights disease-specific patterns at shared loci.	3	27	8	186	224	TRUE
Chronic inflammatory sinonasal disease	Inflammatory and infectious upper respiratory diseases associate with 41 genomic loci and type 2 inflammation.	0	0	1	12	13	TRUE
Chronic obstructive pulmonary disease	Genetic landscape of chronic obstructive pulmonary disease identifies heterogeneous cell-type and phenotype associations.	0	6	1	92	99	TRUE
Chronic obstructive pulmonary disease (moderate to severe)	Risk loci for chronic obstructive pulmonary disease: a genome-wide association study and meta-analysis.	0	0	0	4	4	TRUE
Chronic rhinosinusitis	A loss-of-function variant in ALOX15 protects against nasal polyps and chronic rhinosinusitis.	0	0	1	1	2	TRUE
Chronic rhinosinusitis (MTAG)	Inflammatory and infectious upper respiratory diseases associate with 41 genomic loci and type 2 inflammation.	0	1	0	7	8	TRUE
Chronic sinusitis	A cross-population atlas of genetic associations for 220 human phenotypes.	0	0	1	9	10	TRUE
Cold sores	Genome-wide association and HLA region fine-mapping studies identify susceptibility loci for multiple common infections.	0	0	0	4	4	TRUE
Crohn's disease	Genome-wide association study of Crohn's disease in Koreans revealed three new susceptibility loci and common attributes of genetic susceptibility across ethnic populations.	0	1	1	6	8	TRUE
Cutaneous lupus erythematosus	Genome-wide association study identifies new susceptibility loci for cutaneous lupus erythematosus.	0	6	0	1	7	TRUE
Cutaneous mastocytosis	Results from a Genome-Wide Association Study (GWAS) in Mastocytosis Reveal New Gene Polymorphisms Associated with WHO Subgroups.	0	0	0	7	7	TRUE
Cutaneous psoriasis	Genome-wide Association Analysis of Psoriatic Arthritis and Cutaneous Psoriasis Reveals Differences in Their Genetic Architecture.	0	1	0	4	5	TRUE
Dermatomyositis	Genome-wide imputation identifies novel associations and localises signals in idiopathic inflammatory myopathies.	0	1	0	0	1	TRUE
Dermatomyositis or juvenile dermatomyositis	Dense genotyping of immune-related loci in idiopathic inflammatory myopathies confirms HLA alleles as the strongest genetic risk factor and suggests different genetic background for major clinical subgroups.	0	1	0	0	1	TRUE
Diabetes (standard GWA)	Participation bias in the UK Biobank distorts genetic associations and downstream analyses.	0	4	1	33	38	TRUE
Diffuse cutaneous systemic sclerosis	Gene-level association analysis of systemic sclerosis: A comparison of African-Americans and White populations.	0	0	0	2	2	TRUE
Diverticular disease	Genome-wide association analyses identify 39 new susceptibility loci for diverticular disease.	0	2	0	37	39	TRUE
Dupuytren's disease	Wnt signaling and Dupuytren's disease.	0	2	0	7	9	TRUE
Early chronic obstructive pulmonary disease in never smokers	A Genome-Wide Association Study in Early COPD: Identification of One Major Susceptibility Loci.	0	0	0	0	0	TRUE
Early-onset myasthenia gravis	Identification of genetic risk loci and prioritization of genes and pathways for myasthenia gravis: a genome-wide association study.	0	1	0	1	2	TRUE
Eczema	Rare variant analysis in eczema identifies exonic variants in DUSP1, NOTCH4 and SLC9A4.	0	5	1	41	47	TRUE
Endometriosis	A cross-population atlas of genetic associations for 220 human phenotypes.	0	2	0	7	9	TRUE
Endometriosis (MTAG)	The genetic basis of endometriosis and comorbidity with other pain and inflammatory conditions.	0	3	0	47	50	TRUE
Endometriosis (stage 3 or 4)	The genetic basis of endometriosis and comorbidity with other pain and inflammatory conditions.	0	1	0	7	8	TRUE
Eosinophilic esophagitis	Genetic variants at the 16p13 locus confer risk for eosinophilic esophagitis.	0	1	0	0	1	TRUE
Frontal fibrosing alopecia	Genome-wide association study in frontal fibrosing alopecia identifies four susceptibility loci including HLA-B*07:02.	0	1	0	9	10	TRUE
Fulminant type 1 diabetes	A genome-Wide Association Study Confirming a Strong Effect of HLA and Identifying Variants in CSAD/lnc-ITGB7-1 on Chromosome 12q13.13 Associated with Susceptibility to Fulminant Type 1 Diabetes.	0	0	1	2	3	TRUE
Giant cell arteritis	A Genome-wide Association Study Identifies Risk Alleles in Plasminogen and P4HA2 Associated with Giant Cell Arteritis.	0	1	1	2	4	TRUE
Graves' disease	A genome-wide association study identifies two new risk loci for Graves' disease.	0	5	1	3	9	TRUE
HIV-1 control	Common genetic variation and the control of HIV-1 in humans.	0	1	0	4	5	TRUE
HIV-1 susceptibility	Transcriptome-wide association study of HIV-1 acquisition identifies <i>HERC1</i> as a susceptibility gene.	0	0	0	1	1	TRUE
Hashimoto thyroiditis	A cross-population atlas of genetic associations for 220 human phenotypes.	0	2	0	14	16	TRUE
Hay fever and/or eczema	Genome-wide association analysis of 350 000 Caucasians from the UK Biobank identifies novel loci for asthma, hay fever and eczema.	2	23	4	125	154	TRUE
Hepatitis B	A genome-wide association study of chronic hepatitis B identified novel risk locus in a Japanese population.	0	3	0	1	4	TRUE
Hepatitis B (viral clearance)	Genome-wide association study confirming association of HLA-DP with protection against chronic hepatitis B and viral clearance in Japanese and Korean.	0	4	0	0	4	TRUE
Hepatitis C (spontaneous viral clearance)	Multi-Ancestry Genome-Wide Association Study of Spontaneous Clearance of Hepatitis C Virus.	0	1	0	5	6	TRUE
Hepatitis C induced liver cirrhosis	A genome-wide association study of HCV-induced liver cirrhosis in the Japanese population identifies novel susceptibility loci at the MHC region.	0	2	0	3	5	TRUE
Hyperthyroidism	Genome-wide analyses identify a role for SLC17A4 and AADAT in thyroid hormone regulation.	0	1	0	8	9	TRUE
Hypothyroidism	A cross-population atlas of genetic associations for 220 human phenotypes.	0	12	1	69	82	TRUE
Idiopathic inflammatory myopathy	Genome-wide imputation identifies novel associations and localises signals in idiopathic inflammatory myopathies.	0	1	0	3	4	TRUE
Idiopathic inflammatory myopathy with anti-Jo1 positive	Genome-wide imputation identifies novel associations and localises signals in idiopathic inflammatory myopathies.	0	1	0	0	1	TRUE
Idiopathic membranous nephropathy	Risk HLA-DQA1 and PLA(2)R1 alleles in idiopathic membranous nephropathy.	0	15	0	6	21	TRUE
Inclusion body myositis	Genome-wide imputation identifies novel associations and localises signals in idiopathic inflammatory myopathies.	0	1	0	0	1	TRUE
Inflammatory bowel disease	Genome-wide association study implicates immune activation of multiple integrin genes in inflammatory bowel disease.	0	10	5	77	92	TRUE
Inflammatory bowel disease (early onset)	Common variants at five new loci associated with early-onset inflammatory bowel disease.	0	0	1	3	4	TRUE
Inflammatory skin disease	Genome-wide comparative analysis of atopic dermatitis and psoriasis gives insight into opposing genetic mechanisms.	0	1	1	49	51	TRUE
Juvenile idiopathic arthritis (oligoarticular or rheumatoid factor-negative polyarticular)	Dense genotyping of immune-related disease regions identifies 14 new susceptibility loci for juvenile idiopathic arthritis.	0	5	1	14	20	TRUE
Kawasaki disease	Identification of novel locus associated with coronary artery aneurysms and validation of loci for susceptibility to Kawasaki disease.	0	0	1	3	4	TRUE
Late-onset Alzheimer's disease	A genome-wide association study with 1,126,563 individuals identifies new risk loci for Alzheimer's disease.	0	3	0	35	38	TRUE
Late-onset myasthenia gravis	Genome-wide Association Study of Late-Onset Myasthenia Gravis: Confirmation of TNFRSF11A, and Identification of ZBTB10 and Three Distinct HLA Associations.	1	1	0	4	6	TRUE
Leprosy	Identification of shared loci associated with both Crohn's disease and leprosy in east Asians.	0	3	0	5	8	TRUE
Limited cutaneous systemic scleroderma	Gene-level association analysis of systemic sclerosis: A comparison of African-Americans and White populations.	0	0	0	6	6	TRUE
Malaria	Insights into malaria susceptibility using genome-wide data on 17,000 individuals from Africa, Asia and Oceania.	0	0	0	15	15	TRUE
Membranous nephropathy	Genetic risk variants for membranous nephropathy: extension of and association with other chronic kidney disease aetiologies.	0	1	0	1	2	TRUE
Mononucleosis	Genome-wide association and HLA region fine-mapping studies identify susceptibility loci for multiple common infections.	0	0	0	1	1	TRUE
Morbidity in COVID-19 (deceased vs asymptomatic)	First report on genome wide association study in western Indian population reveals host genetic factors for COVID-19 severity and outcome.	0	0	0	1	1	TRUE
Mortality in COVID-19	Genetic variants are identified to increase risk of COVID-19 related mortality from UK Biobank data.	0	0	0	0	0	TRUE
Multiple sclerosis	Analysis of immune-related loci identifies 48 new susceptibility variants for multiple sclerosis.	0	14	7	76	97	TRUE
Multiple sclerosis (OCB status)	Oligoclonal band status in Scandinavian multiple sclerosis patients is associated with specific genetic risk alleles.	0	3	0	4	7	TRUE
Multiple sclerosis (severity)	Genome-wide association analysis of susceptibility and clinical phenotype in multiple sclerosis.	0	0	0	0	0	TRUE
Mumps	Genome-wide association and HLA region fine-mapping studies identify susceptibility loci for multiple common infections.	0	1	0	8	9	TRUE
Myasthenia gravis	Identification of genetic risk loci and prioritization of genes and pathways for myasthenia gravis: a genome-wide association study.	0	1	0	4	5	TRUE
Myositis	Genome-wide association study identifies HLA 8.1 ancestral haplotype alleles as major genetic risk factors for myositis phenotypes.	0	2	0	21	23	TRUE
Neonatal lupus	Identification of candidate loci at 6p21 and 21q22 in a genome-wide association study of cardiac manifestations of neonatal lupus.	0	1	0	0	1	TRUE
Non-tuberculous mycobacterial pulmonary disease	Genome-wide association study of non-tuberculous mycobacterial pulmonary disease.	0	0	0	0	0	TRUE
Nonatopic asthma	Shared Genetic and Experimental Links between Obesity-Related Traits and Asthma Subtypes in UK Biobank.	0	12	4	82	98	TRUE
Ocular sarcoidosis	Genome-Wide Association Study of Ocular Sarcoidosis Confirms HLA Associations and Implicates Barrier Function and Autoimmunity in African Americans.	0	0	0	4	4	TRUE
Parkinson disease	A genome-wide association study coupled with machine learning approaches to identify influential demographic and genomic factors underlying Parkinson's disease.	0	2	0	11	13	TRUE
Parkinson disease and lewy body pathology	PARK10 is a major locus for sporadic neuropathologically confirmed Parkinson disease.	0	0	0	0	0	TRUE
Parkinson's disease	Web-based genome-wide association study identifies two novel loci and a substantial genetic component for Parkinson's disease.	0	0	1	6	7	TRUE
Parkinson's disease (motor and cognition)	Genomic determinants of motor and cognitive outcomes in Parkinson's disease.	0	0	0	0	0	TRUE
Parkinson's disease or first degree relation to individual with Parkinson's disease	Identification of novel risk loci, causal insights, and heritable risk for Parkinson's disease: a meta-analysis of genome-wide association studies.	0	12	3	92	107	TRUE
Pediatric asthma	A cross-population atlas of genetic associations for 220 human phenotypes.	0	3	1	31	35	TRUE
Pediatric autoimmune diseases	Meta-analysis of shared genetic architecture across ten pediatric autoimmune diseases.	0	4	0	22	26	TRUE
Pemphigus vulgaris	Association study and fine-mapping major histocompatibility complex analysis of pemphigus vulgaris in a Han Chinese population.	0	0	0	4	4	TRUE
Persistent hepatitis B virus infection	Genome-wide association study identifies new loci associated with risk of HBV infection and disease progression.	0	2	0	0	2	TRUE
Pneumonia	The genetic architecture of pneumonia susceptibility implicates mucin biology and a relationship with psychiatric illness.	0	1	0	4	5	TRUE
Polymyositis	Dense genotyping of immune-related loci in idiopathic inflammatory myopathies confirms HLA alleles as the strongest genetic risk factor and suggests different genetic background for major clinical subgroups.	0	1	0	1	2	TRUE
Primary biliary cholangitis	An international genome-wide meta-analysis of primary biliary cholangitis: novel risk loci and candidate drugs.	0	15	6	77	98	TRUE
Primary biliary cirrhosis	Dense fine-mapping study identifies new susceptibility loci for primary biliary cirrhosis.	1	3	2	38	44	TRUE
Primary sclerosing cholangitis	Genome-wide association analysis in primary sclerosing cholangitis identifies two non-HLA susceptibility loci.	0	1	0	1	2	TRUE
Primary sclerosing cholangitis (MTAG)	Multitrait genome-wide analyses identify new susceptibility loci and candidate drugs to primary sclerosing cholangitis.	1	6	1	13	21	TRUE
Psoriasis	Genome-wide scan reveals association of psoriasis with IL-23 and NF-kappaB pathways.	0	1	0	6	7	TRUE
Psoriasis vulgaris	Genome-wide Association Analysis of Psoriatic Arthritis and Cutaneous Psoriasis Reveals Differences in Their Genetic Architecture.	1	2	1	21	25	TRUE
Psoriatic arthritis	Genome-wide Association Analysis of Psoriatic Arthritis and Cutaneous Psoriasis Reveals Differences in Their Genetic Architecture.	0	1	0	4	5	TRUE
Resistance to COVID-19 infection (Exposed negative vs positive)	Better safe than sorry-Whole-genome sequencing indicates that missense variants are significant in susceptibility to COVID-19.	0	16	7	232	255	TRUE
Rheumatoid arthritis	Meta-analysis identifies nine new loci associated with rheumatoid arthritis in the Japanese population.	0	1	0	8	9	TRUE
Rheumatoid arthritis (ACPA-negative)	A genome-wide association study of rheumatoid arthritis without antibodies against citrullinated peptides.	0	1	0	1	2	TRUE
Rheumatoid arthritis (ACPA-positive)	High-density genotyping of immune loci in Koreans and Europeans identifies eight new rheumatoid arthritis risk loci.	2	6	5	30	43	TRUE
Rheumatoid arthritis (rheumatoid factor and anti-cyclic citrullinated peptide seronegative)	Multiomics analysis of rheumatoid arthritis yields sequence variants that have large effects on risk of the seropositive subset.	0	1	0	1	2	TRUE
Rheumatoid arthritis (rheumatoid factor and/or anti-cyclic citrullinated peptide seropositive)	Multiomics analysis of rheumatoid arthritis yields sequence variants that have large effects on risk of the seropositive subset.	4	5	3	30	42	TRUE
SARS-CoV-2 infection	Mapping the human genetic architecture of COVID-19.	0	1	0	7	8	TRUE
Sarcoidosis	Identification of Immune-Relevant Factors Conferring Sarcoidosis Genetic Risk.	0	3	0	3	6	TRUE
Sarcoidosis (Lofgren's syndrome vs non-Lofgren's syndrome)	High-Density Genetic Mapping Identifies New Susceptibility Variants in Sarcoidosis Phenotypes and Shows Genomic-driven Phenotypic Differences.	0	21	0	4	25	TRUE
Sarcoidosis (Lofgren's syndrome)	High-Density Genetic Mapping Identifies New Susceptibility Variants in Sarcoidosis Phenotypes and Shows Genomic-driven Phenotypic Differences.	0	1	0	0	1	TRUE
Sarcoidosis (non-Lofgren's syndrome without extrapulmonary manifestations)	High-Density Genetic Mapping Identifies New Susceptibility Variants in Sarcoidosis Phenotypes and Shows Genomic-driven Phenotypic Differences.	1	0	0	1	2	TRUE
Sarcoidosis (non-Lofgren's syndrome)	High-Density Genetic Mapping Identifies New Susceptibility Variants in Sarcoidosis Phenotypes and Shows Genomic-driven Phenotypic Differences.	1	0	0	0	1	TRUE
Scarlet fever	Genome-wide association and HLA region fine-mapping studies identify susceptibility loci for multiple common infections.	0	0	0	4	4	TRUE
Self-reported allergy	A genome-wide association meta-analysis of self-reported allergy identifies shared and allergy-specific susceptibility loci.	0	3	1	11	15	TRUE
Sepsis in extremely premature infants	Genome-wide association study of sepsis in extremely premature infants.	0	0	0	0	0	TRUE
Sero-negative rheumatoid arthritis	Genotypic variability based association identifies novel non-additive loci DHCR7 and IRF4 in sero-negative rheumatoid arthritis.	0	2	0	0	2	TRUE
Severe COVID-19 infection	Better safe than sorry-Whole-genome sequencing indicates that missense variants are significant in susceptibility to COVID-19.	0	29	1	261	291	TRUE
Severe autoimmune type 2 diabetes	Genome-wide association analyses highlight etiological differences underlying newly defined subtypes of diabetes.	0	0	1	0	1	TRUE
Shingles	Genome-wide association and HLA region fine-mapping studies identify susceptibility loci for multiple common infections.	0	14	0	22	36	TRUE
Sinonasal disease	Inflammatory and infectious upper respiratory diseases associate with 41 genomic loci and type 2 inflammation.	0	0	0	13	13	TRUE
Strep throat	Genome-wide association and HLA region fine-mapping studies identify susceptibility loci for multiple common infections.	0	1	0	2	3	TRUE
