trait	study	hit_combat	hit_onek1k	hit_both	hit_neither	snp_count	hit_check
Systemic juvenile idiopathic arthritis	Genetic architecture distinguishes systemic juvenile idiopathic arthritis from other forms of juvenile idiopathic arthritis: clinical and therapeutic implications.	0	1	0	1	2	TRUE
Systemic lupus erythematosus	Genome-wide association study on Northern Chinese identifies KLF2, DOT1L and STAB2 associated with systemic lupus erythematosus.	0	1	0	8	9	TRUE
Systemic lupus erythematosus (MTAG)	Multi-ancestry and multi-trait genome-wide association meta-analyses inform clinical risk prediction for systemic lupus erythematosus.	1	28	7	209	245	TRUE
Systemic lupus erythematosus and Systemic sclerosis	A systemic sclerosis and systemic lupus erythematosus pan-meta-GWAS reveals new shared susceptibility loci.	0	1	1	9	11	TRUE
Systemic sclerosis	Identification of novel genetic markers associated with clinical phenotypes of systemic sclerosis through a genome-wide association strategy.	0	3	1	5	9	TRUE
Systemic seropositive rheumatic diseases (Systemic sclerosis or systemic lupus erythematosus or rheumatoid arthritis or idiopathic inflammatory myopathies)	Genome-wide meta-analysis reveals shared new loci in systemic seropositive rheumatic diseases.	0	2	2	22	26	TRUE
Takayasu arteritis	Genetic determinants and an epistasis of LILRA3 and HLA-B*52 in Takayasu arteritis.	1	1	0	5	7	TRUE
Tonsillitis	The Psoriasis Risk Allele <i>HLA-C*06:02</i> Shows Evidence of Association with Chronic or Recurrent Streptococcal Tonsillitis.	0	0	0	0	0	TRUE
Tuberculosis	Discovery of susceptibility loci associated with tuberculosis in Han Chinese.	0	0	0	3	3	TRUE
Type 1 diabetes	Robust associations of four new chromosome regions from genome-wide analyses of type 1 diabetes.	0	1	0	7	8	TRUE
Ulcerative colitis	Association analyses identify 38 susceptibility loci for inflammatory bowel disease and highlight shared genetic risk across populations.	2	8	4	76	90	TRUE
Ulcerative colitis or Crohn's disease	HLA-Cw*1202-B*5201-DRB1*1502 haplotype increases risk for ulcerative colitis but reduces risk for Crohn's disease.	0	1	0	1	2	TRUE
Vitiligo	Variant of TYR and autoimmunity susceptibility loci in generalized vitiligo.	0	1	0	8	9	TRUE
Wegener's granulomatosis	Association of granulomatosis with polyangiitis (Wegener's) with HLA-DPB1*04 and SEMA6A gene variants: evidence from genome-wide analysis.	0	1	0	1	2	TRUE
